{
  "schemaVersion": 1,
  "system": "DSYS-001",
  "version": "0.1.0",
  "tokens": {
    "color": {
      "primitive": {
        "blue-600": { "value": "#2563EB", "type": "color" },
        "green-700": { "value": "#15803D", "type": "color" },
        "red-700": { "value": "#B91C1C", "type": "color" },
        "slate-950": { "value": "#020617", "type": "color" },
        "white": { "value": "#FFFFFF", "type": "color" }
      },
      "semantic": {
        "action-primary-background": { "value": "{color.primitive.blue-600}", "type": "color" },
        "feedback-success": { "value": "{color.primitive.green-700}", "type": "color" },
        "feedback-error": { "value": "{color.primitive.red-700}", "type": "color" },
        "text-primary": { "value": "{color.primitive.slate-950}", "type": "color" },
        "surface-default": { "value": "{color.primitive.white}", "type": "color" }
      }
    },
    "spacing": {
      "primitive": {
        "8": { "value": "8px", "type": "dimension" },
        "24": { "value": "24px", "type": "dimension" }
      },
      "semantic": {
        "control-gap": { "value": "{spacing.primitive.8}", "type": "dimension" },
        "section-gap": { "value": "{spacing.primitive.24}", "type": "dimension" }
      }
    },
    "size": { "touch-target-min": { "value": "44px", "type": "dimension" } }
  }
}
